{
  "$schema": "../config.schema.json",
  "version": "1.0",
  "team": {
    "name": "My Team",
    "reviewers": [
      { "name": "Alice Smith", "github": "alice-gh", "azure": "Alice Smith" },
      { "name": "Bob Jones", "github": "bob-jones", "azure": "Bob Jones" },
      { "name": "Charlie Dev", "github": "charlie-d", "azure": "Charlie Dev" }
    ]
  },
  "repo": {
    "backend": "github",
    "org": "my-org",
    "name": "my-repo",
    "base_branch": "main",
    "branch_prefix": "feature/",
    "commit_style": "conventional"
  },
  "tools": {
    "gh_path": "gh",
    "az_path": "az",
    "docker": false
  },
  "workflow": {
    "gates": ["spec", "plan", "pr"],
    "fast_track_enabled": true,
    "max_retries_per_stage": 3,
    "max_test_review_loops": 5,
    "parallel_tests": true,
    "auto_document": true
  },
  "pr_template": "built-in"
}
